{
  "image_width": 1920,
  "image_height": 1080,
  "element_count": 151,
  "elements": [
    {
      "som_id": 1,
      "label": "computer monitor",
      "bbox": {
        "x": 0,
        "y": 0,
        "width": 1074,
        "height": 589
      },
      "confidence": 0.5,
      "source": "florence2"
    },
    {
      "som_id": 2,
      "label": "mobile phone",
      "bbox": {
        "x": 1026,
        "y": 0,
        "width": 893,
        "height": 589
      },
      "confidence": 0.5,
      "source": "florence2"
    },
    {
      "som_id": 3,
      "label": "[redacted]",
      "bbox": {
        "x": 41,
        "y": 2,
        "width": 39,
        "height": 13
      },
      "confidence": 1,
      "source": "vision_text"
    },
    {
      "som_id": 4,
      "label": "[redacted]",
      "bbox": {
        "x": 136,
        "y": 2,
        "width": 30,
        "height": 13
      },
      "confidence": 1,
      "source": "vision_text"
    },
    {
      "som_id": 5,
      "label": "[redacted]",
      "bbox": {
        "x": 181,
        "y": 2,
        "width": 61,
        "height": 13
      },
      "confidence": 1,
      "source": "vision_text"
    },
    {
      "som_id": 6,
      "label": "[redacted]",
      "bbox": {
        "x": 256,
        "y": 2,
        "width": 36,
        "height": 13
      },
      "confidence": 1,
      "source": "vision_text"
    },
    {
      "som_id": 7,
      "label": "Go",
      "bbox": {
        "x": 309,
        "y": 2,
        "width": 19,
        "height": 13
      },
      "confidence": 1,
      "source": "vision_text"
    },
    {
      "som_id": 8,
      "label": "Window",
      "bbox": {
        "x": 463,
        "y": 2,
        "width": 53,
        "height": 13
      },
      "confidence": 1,
      "source": "vision_text"
    },
    {
      "som_id": 9,
      "label": "Help",
      "bbox": {
        "x": 530,
        "y": 2,
        "width": 33,
        "height": 13
      },
      "confidence": 1,
      "source": "vision_text"
    },
    {
      "som_id": 10,
      "label": "[redacted]",
      "bbox": {
        "x": 1805,
        "y": 2,
        "width": 27,
        "height": 16
      },
      "confidence": 1,
      "source": "vision_text"
    },
    {
      "som_id": 11,
      "label": "[redacted]",
      "bbox": {
        "x": 1613,
        "y": 44,
        "width": 92,
        "height": 13
      },
      "confidence": 1,
      "source": "vision_text"
    },
    {
      "som_id": 12,
      "label": "[redacted]",
      "bbox": {
        "x": 1758,
        "y": 44,
        "width": 92,
        "height": 14
      },
      "confidence": 1,
      "source": "vision_text"
    },
    {
      "som_id": 13,
      "label": "Q devenv",
      "bbox": {
        "x": 708,
        "y": 47,
        "width": 64,
        "height": 14
      },
      "confidence": 0.5,
      "source": "vision_text"
    },
    {
      "som_id": 14,
      "label": "08",
      "bbox": {
        "x": 1356,
        "y": 47,
        "width": 19,
        "height": 16
      },
      "confidence": 1,
      "source": "vision_text"
    },
    {
      "som_id": 15,
      "label": "rectangle",
      "bbox": {
        "x": 1064,
        "y": 62,
        "width": 149,
        "height": 42
      },
      "confidence": 1,
      "source": "vision_rect"
    },
    {
      "som_id": 16,
      "label": "[redacted]",
      "bbox": {
        "x": 53,
        "y": 73,
        "width": 77,
        "height": 28
      },
      "confidence": 1,
      "source": "vision_rect"
    },
    {
      "som_id": 17,
      "label": "rectangle",
      "bbox": {
        "x": 390,
        "y": 77,
        "width": 14,
        "height": 24
      },
      "confidence": 1,
      "source": "vision_rect"
    },
    {
      "som_id": 18,
      "label": "* Settings",
      "bbox": {
        "x": 309,
        "y": 82,
        "width": 72,
        "height": 18
      },
      "confidence": 1,
      "source": "vision_text"
    },
    {
      "som_id": 19,
      "label": "[redacted]",
      "bbox": {
        "x": 61,
        "y": 83,
        "width": 64,
        "height": 13
      },
      "confidence": 1,
      "source": "vision_text"
    },
    {
      "som_id": 20,
      "label": "\u2192 Claude Code X",
      "bbox": {
        "x": 1079,
        "y": 83,
        "width": 122,
        "height": 14
      },
      "confidence": 1,
      "source": "vision_text"
    },
    {
      "som_id": 21,
      "label": "Ma Execution-Pla",
      "bbox": {
        "x": 1222,
        "y": 83,
        "width": 108,
        "height": 14
      },
      "confidence": 1,
      "source": "vision_text"
    },
    {
      "som_id": 22,
      "label": "[redacted]",
      "bbox": {
        "x": 1551,
        "y": 86,
        "width": 16,
        "height": 16
      },
      "confidence": 1,
      "source": "vision_text"
    },
    {
      "som_id": 23,
      "label": "[redacted]",
      "bbox": {
        "x": 1654,
        "y": 86,
        "width": 262,
        "height": 16
      },
      "confidence": 1,
      "source": "vision_text"
    },
    {
      "som_id": 24,
      "label": "[redacted]",
      "bbox": {
        "x": 47,
        "y": 111,
        "width": 103,
        "height": 14
      },
      "confidence": 1,
      "source": "vision_text"
    },
    {
      "som_id": 25,
      "label": "rectangle",
      "bbox": {
        "x": 1079,
        "y": 116,
        "width": 156,
        "height": 25
      },
      "confidence": 1,
      "source": "vision_rect"
    },
    {
      "som_id": 26,
      "label": "Past Conversations v",
      "bbox": {
        "x": 1088,
        "y": 119,
        "width": 139,
        "height": 13
      },
      "confidence": 1,
      "source": "vision_text"
    },
    {
      "som_id": 27,
      "label": "Search settings",
      "bbox": {
        "x": 323,
        "y": 128,
        "width": 97,
        "height": 14
      },
      "confidence": 1,
      "source": "vision_text"
    },
    {
      "som_id": 28,
      "label": "[redacted]",
      "bbox": {
        "x": 1509,
        "y": 129,
        "width": 390,
        "height": 866
      },
      "confidence": 1,
      "source": "vision_rect"
    },
    {
      "som_id": 29,
      "label": "[redacted]",
      "bbox": {
        "x": 47,
        "y": 133,
        "width": 66,
        "height": 14
      },
      "confidence": 1,
      "source": "vision_text"
    },
    {
      "som_id": 30,
      "label": "[redacted]",
      "bbox": {
        "x": 1815,
        "y": 140,
        "width": 83,
        "height": 35
      },
      "confidence": 1,
      "source": "vision_rect"
    },
    {
      "som_id": 31,
      "label": "[redacted]",
      "bbox": {
        "x": 1825,
        "y": 144,
        "width": 69,
        "height": 20
      },
      "confidence": 1,
      "source": "vision_text"
    },
    {
      "som_id": 32,
      "label": "[redacted]",
      "bbox": {
        "x": 255,
        "y": 149,
        "width": 29,
        "height": 29
      },
      "confidence": 1,
      "source": "vision_rect"
    },
    {
      "som_id": 33,
      "label": "* Claude Code",
      "bbox": {
        "x": 1208,
        "y": 158,
        "width": 125,
        "height": 23
      },
      "confidence": 1,
      "source": "vision_text"
    },
    {
      "som_id": 34,
      "label": "User",
      "bbox": {
        "x": 323,
        "y": 167,
        "width": 33,
        "height": 13
      },
      "confidence": 1,
      "source": "vision_text"
    },
    {
      "som_id": 35,
      "label": "Workspace",
      "bbox": {
        "x": 368,
        "y": 167,
        "width": 72,
        "height": 13
      },
      "confidence": 1,
      "source": "vision_text"
    },
    {
      "som_id": 36,
      "label": "Last synced: 0 secs ago",
      "bbox": {
        "x": 898,
        "y": 167,
        "width": 153,
        "height": 17
      },
      "confidence": 1,
      "source": "vision_text"
    },
    {
      "som_id": 37,
      "label": "[redacted]",
      "bbox": {
        "x": 100,
        "y": 178,
        "width": 86,
        "height": 13
      },
      "confidence": 1,
      "source": "vision_text"
    },
    {
      "som_id": 38,
      "label": "[redacted]",
      "bbox": {
        "x": 1749,
        "y": 188,
        "width": 49,
        "height": 66
      },
      "confidence": 1,
      "source": "vision_rect"
    },
    {
      "som_id": 39,
      "label": "[redacted]",
      "bbox": {
        "x": 103,
        "y": 200,
        "width": 58,
        "height": 13
      },
      "confidence": 1,
      "source": "vision_text"
    },
    {
      "som_id": 40,
      "label": "[redacted]",
      "bbox": {
        "x": 1561,
        "y": 205,
        "width": 70,
        "height": 32
      },
      "confidence": 1,
      "source": "vision_rect"
    },
    {
      "som_id": 41,
      "label": "Commonly Used",
      "bbox": {
        "x": 348,
        "y": 209,
        "width": 108,
        "height": 17
      },
      "confidence": 1,
      "source": "vision_text"
    },
    {
      "som_id": 42,
      "label": "[redacted]",
      "bbox": {
        "x": 1560,
        "y": 211,
        "width": 69,
        "height": 14
      },
      "confidence": 1,
      "source": "vision_text"
    },
    {
      "som_id": 43,
      "label": "Commonly Used",
      "bbox": {
        "x": 533,
        "y": 214,
        "width": 198,
        "height": 28
      },
      "confidence": 1,
      "source": "vision_text"
    },
    {
      "som_id": 44,
      "label": "[redacted]",
      "bbox": {
        "x": 106,
        "y": 223,
        "width": 133,
        "height": 13
      },
      "confidence": 1,
      "source": "vision_text"
    },
    {
      "som_id": 45,
      "label": "> Text Editor",
      "bbox": {
        "x": 332,
        "y": 231,
        "width": 83,
        "height": 14
      },
      "confidence": 1,
      "source": "vision_text"
    },
    {
      "som_id": 46,
      "label": "[redacted]",
      "bbox": {